{
  "contract_version": "1.0.0-draft",
  "generated_at": "2026-09-24T00:00:00Z",
  "snapshot": {
    "dataset": "carindex_master.csv + vehicle_candidates.csv (Drive, 2026-09-17)",
    "collection_date": "2026-09-10"
  },
  "entity": {
    "model_id": "mg-4",
    "cohort_id": "mg-4@2026",
    "variant_id": "mg-4@2026/luxury",
    "brand": "MG",
    "model": "4",
    "trim": "Luxury",
    "trim_aliases": [
      {
        "source_id": "contactcars",
        "raw": "Luxury"
      }
    ],
    "selection_reason": "battery-electric: battery and range present, consumption absent",
    "candidate_layer": {
      "brand": "MG",
      "model": "4",
      "model_year": "2026",
      "variant_normalized": "Standard/Luxury (2 trims)",
      "sources": "ContactCars only",
      "prices": "1,200,000 / 1,400,000",
      "status": "CONFIRMED_MATCH (Hatla2ee range only, no trim split)",
      "notes": "Electric SUV/hatchback, 51kWh/64kWh battery options, 168/200hp. Hatla2ee confirms 1,200,000-1,400,000 range."
    }
  },
  "sources": {
    "contactcars": {
      "name": "ContactCars",
      "publisher": "ContactCars",
      "type": "aggregator_listing",
      "tier": "C",
      "url": "https://www.contactcars.com/en/new-cars/mg-4/year-2026"
    }
  },
  "observations": [
    {
      "obs_id": "o001",
      "entity_ref": "mg-4@2026/luxury",
      "attribute": "model_year",
      "raw_value": "2026",
      "source_id": "contactcars",
      "source_url": "https://www.contactcars.com/en/new-cars/mg-4/year-2026",
      "observed_at": "2026-09-10",
      "record_ref": "carindex_master.csv:359:model_year"
    },
    {
      "obs_id": "o002",
      "entity_ref": "mg-4",
      "attribute": "body_type",
      "raw_value": "SUV",
      "source_id": "contactcars",
      "source_url": "https://www.contactcars.com/en/new-cars/mg-4/year-2026",
      "observed_at": "2026-09-10",
      "record_ref": "carindex_master.csv:359:body_type_normalized"
    },
    {
      "obs_id": "o003",
      "entity_ref": "mg-4@2026/luxury",
      "attribute": "official_price_egp",
      "raw_value": "1,400,000",
      "source_id": "contactcars",
      "source_url": "https://www.contactcars.com/en/new-cars/mg-4/year-2026",
      "observed_at": "2026-09-10",
      "record_ref": "carindex_master.csv:359:official_price"
    },
    {
      "obs_id": "o004",
      "entity_ref": "mg-4@2026/luxury",
      "attribute": "market_price_egp",
      "raw_value": "1,600,000",
      "source_id": "contactcars",
      "source_url": "https://www.contactcars.com/en/new-cars/mg-4/year-2026",
      "observed_at": "2026-09-10",
      "record_ref": "carindex_master.csv:359:market_price"
    },
    {
      "obs_id": "o005",
      "entity_ref": "mg-4@2026/luxury",
      "attribute": "fuel_type",
      "raw_value": "Electric",
      "source_id": "contactcars",
      "source_url": "https://www.contactcars.com/en/new-cars/mg-4/year-2026",
      "observed_at": "2026-09-10",
      "record_ref": "carindex_master.csv:359:fuel_type_raw"
    },
    {
      "obs_id": "o006",
      "entity_ref": "mg-4@2026/luxury",
      "attribute": "power_hp",
      "raw_value": "200",
      "source_id": "contactcars",
      "source_url": "https://www.contactcars.com/en/new-cars/mg-4/year-2026",
      "observed_at": "2026-09-10",
      "record_ref": "carindex_master.csv:359:horsepower"
    },
    {
      "obs_id": "o007",
      "entity_ref": "mg-4@2026/luxury",
      "attribute": "transmission",
      "raw_value": "Automatic",
      "source_id": "contactcars",
      "source_url": "https://www.contactcars.com/en/new-cars/mg-4/year-2026",
      "observed_at": "2026-09-10",
      "record_ref": "carindex_master.csv:359:transmission"
    },
    {
      "obs_id": "o008",
      "entity_ref": "mg-4@2026/luxury",
      "attribute": "battery_kwh",
      "raw_value": "64kWh",
      "source_id": "contactcars",
      "source_url": "https://www.contactcars.com/en/new-cars/mg-4/year-2026",
      "observed_at": "2026-09-10",
      "record_ref": "carindex_master.csv:359:battery_capacity"
    },
    {
      "obs_id": "o009",
      "entity_ref": "mg-4@2026/luxury",
      "attribute": "electric_range_km",
      "raw_value": "450km",
      "source_id": "contactcars",
      "source_url": "https://www.contactcars.com/en/new-cars/mg-4/year-2026",
      "observed_at": "2026-09-10",
      "record_ref": "carindex_master.csv:359:electric_range"
    },
    {
      "obs_id": "o010",
      "entity_ref": "mg-4@2026/luxury",
      "attribute": "equipment",
      "raw_value": "18in wheels, heated steering wheel",
      "source_id": "contactcars",
      "source_url": "https://www.contactcars.com/en/new-cars/mg-4/year-2026",
      "observed_at": "2026-09-10",
      "record_ref": "carindex_master.csv:359:notes"
    }
  ],
  "facts": {
    "model_year": {
      "unit": null,
      "level": "variant",
      "observation_ids": [
        "o001"
      ],
      "value": 2026,
      "qualifiers": {},
      "status": "single_source",
      "confidence": "medium",
      "valid_as_of": "2026-09-10"
    },
    "trim_name": {
      "unit": null,
      "level": "variant",
      "observation_ids": [],
      "value": null,
      "status": "unknown",
      "confidence": "unknown",
      "valid_as_of": null,
      "unknown_reason": "no_observation"
    },
    "body_type": {
      "unit": null,
      "level": "model",
      "observation_ids": [
        "o002"
      ],
      "value": "suv",
      "qualifiers": {},
      "status": "single_source",
      "confidence": "medium",
      "valid_as_of": "2026-09-10"
    },
    "official_price_egp": {
      "unit": "EGP",
      "level": "variant",
      "observation_ids": [
        "o003"
      ],
      "value": 1400000,
      "qualifiers": {},
      "status": "single_source",
      "confidence": "medium",
      "valid_as_of": "2026-09-10"
    },
    "market_price_egp": {
      "unit": "EGP",
      "level": "variant",
      "observation_ids": [
        "o004"
      ],
      "value": 1600000,
      "qualifiers": {},
      "status": "single_source",
      "confidence": "medium",
      "valid_as_of": "2026-09-10"
    },
    "price_range_egp": {
      "unit": "EGP",
      "level": "cohort",
      "observation_ids": [],
      "value": null,
      "status": "unknown",
      "confidence": "unknown",
      "valid_as_of": null,
      "unknown_reason": "no_observation"
    },
    "fuel_type": {
      "unit": null,
      "level": "variant",
      "observation_ids": [
        "o005"
      ],
      "value": "bev",
      "qualifiers": {},
      "status": "single_source",
      "confidence": "medium",
      "valid_as_of": "2026-09-10"
    },
    "engine_displacement_cc": {
      "unit": "cc",
      "level": "variant",
      "observation_ids": [],
      "value": null,
      "status": "unknown",
      "confidence": "unknown",
      "valid_as_of": null,
      "unknown_reason": "no_observation"
    },
    "power_hp": {
      "unit": "hp",
      "level": "variant",
      "observation_ids": [
        "o006"
      ],
      "value": 200.0,
      "qualifiers": {},
      "status": "single_source",
      "confidence": "medium",
      "valid_as_of": "2026-09-10"
    },
    "torque_nm": {
      "unit": "Nm",
      "level": "variant",
      "observation_ids": [],
      "value": null,
      "status": "unknown",
      "confidence": "unknown",
      "valid_as_of": null,
      "unknown_reason": "no_observation"
    },
    "transmission": {
      "unit": null,
      "level": "variant",
      "observation_ids": [
        "o007"
      ],
      "value": "automatic",
      "qualifiers": {},
      "status": "single_source",
      "confidence": "medium",
      "valid_as_of": "2026-09-10"
    },
    "drivetrain": {
      "unit": null,
      "level": "variant",
      "observation_ids": [],
      "value": null,
      "status": "unknown",
      "confidence": "unknown",
      "valid_as_of": null,
      "unknown_reason": "no_observation"
    },
    "battery_kwh": {
      "unit": "kWh",
      "level": "variant",
      "observation_ids": [
        "o008"
      ],
      "value": 64.0,
      "qualifiers": {},
      "status": "single_source",
      "confidence": "medium",
      "valid_as_of": "2026-09-10"
    },
    "electric_range_km": {
      "unit": "km",
      "level": "variant",
      "observation_ids": [
        "o009"
      ],
      "value": 450.0,
      "qualifiers": {},
      "status": "single_source",
      "confidence": "medium",
      "valid_as_of": "2026-09-10"
    },
    "fuel_consumption_l_100km": {
      "unit": "L/100km",
      "level": "variant",
      "observation_ids": [],
      "value": null,
      "status": "unknown",
      "confidence": "unknown",
      "valid_as_of": null,
      "unknown_reason": "no_observation"
    },
    "energy_consumption_kwh_100km": {
      "unit": "kWh/100km",
      "level": "variant",
      "observation_ids": [],
      "value": null,
      "status": "unknown",
      "confidence": "unknown",
      "valid_as_of": null,
      "unknown_reason": "no_observation"
    },
    "seats": {
      "unit": null,
      "level": "variant",
      "observation_ids": [],
      "value": null,
      "status": "unknown",
      "confidence": "unknown",
      "valid_as_of": null,
      "unknown_reason": "no_observation"
    },
    "length_mm": {
      "unit": "mm",
      "level": "cohort",
      "observation_ids": [],
      "value": null,
      "status": "unknown",
      "confidence": "unknown",
      "valid_as_of": null,
      "unknown_reason": "no_observation"
    },
    "width_mm": {
      "unit": "mm",
      "level": "cohort",
      "observation_ids": [],
      "value": null,
      "status": "unknown",
      "confidence": "unknown",
      "valid_as_of": null,
      "unknown_reason": "no_observation"
    },
    "height_mm": {
      "unit": "mm",
      "level": "cohort",
      "observation_ids": [],
      "value": null,
      "status": "unknown",
      "confidence": "unknown",
      "valid_as_of": null,
      "unknown_reason": "no_observation"